"nome","email","login","senha"
"Isaiane Kelly de Chaves","isaiane.chaves@hotmail.com","isaiane.chaves","ai54.A"
"Nicole da Silva","nicole.silva@outlook.com","nicole.silva","ol34.C"
"Luciano Cheimer","luciano.cheimer@bol.com.br","luciano.cheimer","ac65.I"
"Catarina de Vieira Ucatu","catarina.ucatu@outlook.com","catarina.ucatu","ra55.A"
"Ismael Tiago da Silva","ismael.silva@hotmail.com","ismael.silva","mm24.E"
"Reinaldo Krolo Moreno","reinaldo.moreno@msn.com","reinaldo.moreno","ni65.L"
"José Juan Gegrurn de Figueiredo","josé.figueiredo@bol.com.br","josé.figueiredo",".s43.."
"Nilton Gabriel de Pereira da Silva Oaer","nilton.oaer@outlook.com","nilton.oaer","nl35.I"
"Celso Damião de Palhares","celso.palhares@bol.com.br","celso.palhares",".o24.S"
"Avelino de Martins","avelino.martins@hotmail.com","avelino.martins","vl33.L"
"Alexandre Oliver de Camargo","alexandre.camargo@bol.com.br","alexandre.camargo","an15.E"
"Luiz de Camargo da Silva","luiz.silva@hotmail.com","luiz.silva",".z53.Z"
"Yuri Mendes Favilime Júnior","yuri.júnior@bol.com.br","yuri.júnior","i.45.I"
"Filipe Israel Prates","filipe.prates@outlook.com","filipe.prates","ii34.P"
"Nivaldo de Drummond Franco","nivaldo.franco@bol.com.br","nivaldo.franco","dl44.A"
"Romildo Edu dos Santos Júnior","romildo.júnior@bol.com.br","romildo.júnior","mi33.L"
"Tiago Severino da Cunha","tiago.cunha@outlook.com","tiago.cunha","ag34.G"
"Charlene Sabrina Paim Udinuan Duque","charlene.duque@bol.com.br","charlene.duque","la55.R"
"Vívian da Silva de Souza","vívian.souza@hotmail.com","vívian.souza","ii44.I"
"Ezequiel Bartolomeu de Diniz Tarnban","ezequiel.tarnban@hotmail.com","ezequiel.tarnban","uq54.Z"
"Israel Ciro Shihea de Ayres","israel.ayres@msn.com","israel.ayres","aa54.S"
"Viviane Luzimara Maciel Marques","viviane.marques@outlook.com","viviane.marques","iv33.V"
"Sandro Nilo do Amazonas","sandro.amazonas@gmail.com","sandro.amazonas","rn44.R"
"Melanie Keatepli Soli Rosatto","melanie.rosatto@hotmail.com","melanie.rosatto","ll33.N"
"Samara Genir Maean Freire","samara.freire@outlook.com","samara.freire","am32.A"
"Priscila Eliomar Pitaso","priscila.pitaso@bol.com.br","priscila.pitaso","ii33.I"
"Karina Nádia de Gusmão","karina.gusmão@outlook.com","karina.gusmão","nk44.R"
"Marcielle Andréia de Chaves Bossa","marcielle.bossa@bol.com.br","marcielle.bossa","ac24.R"
"Tiago dos Reis Júnior","tiago.júnior@bol.com.br","tiago.júnior","gg33.A"
"Marlon Geineman","marlon.geineman@msn.com","marlon.geineman","rr34.L"
"Lígia de Peres Couto","lígia.couto@outlook.com","lígia.couto","ia45.G"
"Leni Meire de Padilha dos Santos","leni.santos@outlook.com","leni.santos","..34.N"
"Ivete Paim","ivete.paim@gmail.com","ivete.paim","ee43.E"
"Kelly Fernanda Donigiku de Teixeira","kelly.teixeira@outlook.com","kelly.teixeira",".y54.Y"
"Romildo Nuke Aepuz","romildo.aepuz@hotmail.com","romildo.aepuz","ld54.I"
"David da Paraíba Pires","david.pires@hotmail.com","david.pires","ii45.A"
"Solange de Salvador da Silva","solange.silva@outlook.com","solange.silva","la36.A"
"Tiago Alberto de Lemes","tiago.lemes@bol.com.br","tiago.lemes","aa56.G"
"Everton José do Nascimento de Arantes Gibreão","everton.gibreão@gmail.com","everton.gibreão","re55.V"
"Willian de Gusmão","willian.gusmão@outlook.com","willian.gusmão","ll34.L"
"Graziele Leonara de Britto","graziele.britto@outlook.com","graziele.britto","zz54.E"
"Caio Otávio Bapiwo Júnior","caio.júnior@hotmail.com","caio.júnior","oa45.O"
"Nicole Eulália de Pinheiro Klein","nicole.klein@outlook.com","nicole.klein","ll54.C"
"Filipe Luciano dos Santos","filipe.santos@outlook.com","filipe.santos","ii54.L"
"Roberto de Fraga Mutsuchi","roberto.mutsuchi@outlook.com","roberto.mutsuchi","tr35.E"
"Osório Castelo Branco Marques","osório.marques@gmail.com","osório.marques","ir44.R"
"Mônica de Oliveira Ebiys","mônica.ebiys@yahoo.com","mônica.ebiys","nn44.I"
"Jandira Maria de Souza Gusier Torres","jandira.torres@outlook.com","jandira.torres","dn36.D"
"Josilda de Simões Hehi","josilda.hehi@bol.com.br","josilda.hehi","ii54.I"
"Mônica da Cruz","mônica.cruz@outlook.com","mônica.cruz","in54.C"
"Raiane de Sampaio","raiane.sampaio@bol.com.br","raiane.sampaio","ia43.N"
"Yuri Raí Mercado Trevisan de Noronha","yuri.noronha@bol.com.br","yuri.noronha","ir33.."
"Fagner de Leite Hiniman","fagner.hiniman@outlook.com","fagner.hiniman",".g44.."
"Cléber Avelino da Silva Nunes de Figueiredo","cléber.figueiredo@outlook.com","cléber.figueiredo","lé34.B"
"Cleuza Lipuym","cleuza.lipuym@hotmail.com","cleuza.lipuym","ea46.Z"
"Edivaldo de Gonçalves Aier Glimudlos Júnior","edivaldo.júnior@bol.com.br","edivaldo.júnior","ii43.V"
"Jason de Morais Moreno","jason.moreno@outlook.com","jason.moreno","no43.S"
"Suzy Cibele Bowahogi de Pimentel","suzy.pimentel@msn.com","suzy.pimentel","y.45.P"
"Tânia de Leite","tânia.leite@gmail.com","tânia.leite",".i53.A"
"Décio Xerxes dos Santos","décio.santos@outlook.com","décio.santos","ii35.I"
"Mike dos Santos Fulusy","mike.fulusy@bol.com.br","mike.fulusy","ee46.K"
"Eleriane de Alvim da Silva","eleriane.silva@bol.com.br","eleriane.silva","ae42.E"
"Roseli de Muniz Yurasa","roseli.yurasa@hotmail.com","roseli.yurasa","ll44.O"
"Aline Breo","aline.breo@hotmail.com","aline.breo","in55.N"
"Carlos Vlonfe da Silva","carlos.silva@outlook.com","carlos.silva","ll46.R"
"Wagner de Iglesias Vlimcresa","wagner.vlimcresa@outlook.com","wagner.vlimcresa","nn33.N"
"Sabrina de Sá Izfi Aclae","sabrina.aclae@gmail.com","sabrina.aclae","ri45.B"
"Luciana de Angola","luciana.angola@outlook.com","luciana.angola","uu54.I"
"Hellen Margarete Gomes","hellen.gomes@outlook.com","hellen.gomes","ln53.L"
"Melanie Zenaide de Alcântara","melanie.alcântara@outlook.com","melanie.alcântara","nn34.E"
"Ronaldo de Barboza Ielim Júnior","ronaldo.júnior@hotmail.com","ronaldo.júnior","na43.L"
"Itamar Martin Vrasshoz","itamar.vrasshoz@outlook.com","itamar.vrasshoz","aa45.A"
"Meire Teresa de Andrade Valente Yckez","meire.yckez@bol.com.br","meire.yckez","ii42.I"
"Hilton Damião Eivic Mesfo","hilton.mesfo@outlook.com","hilton.mesfo","oi34.T"
"Rosana Ungo","rosana.ungo@hotmail.com","rosana.ungo","on34.A"
"Gigi de Nogueira Isouzpa","gigi.isouzpa@outlook.com","gigi.isouzpa",".i46.I"
"Zuleide de Cardoso dos Santos","zuleide.santos@outlook.com","zuleide.santos","ie55.E"
"Ana de Paula Fortes","ana.fortes@hotmail.com","ana.fortes",".o35.A"
"Yasmin da Graça Oguchi","yasmin.oguchi@gmail.com","yasmin.oguchi","ns35.I"
"Eduardo Luan de Pereira","eduardo.pereira@bol.com.br","eduardo.pereira","ra46.U"
"Rebeca de Barbosa da Cruz Franco","rebeca.franco@hotmail.com","rebeca.franco","bb54.E"
"Leila Arne","leila.arne@hotmail.com","leila.arne",".i63.A"
"Micael Fabrício de Palhares da Silva","micael.silva@msn.com","micael.silva","aa45.L"
"Aline Regina Giezy","aline.giezy@hotmail.com","aline.giezy","lg73.N"
"Ali de Malta","ali.malta@bol.com.br","ali.malta","i.54.."
"Rodrigo Reinaldo Rebi Sabbikribo","rodrigo.sabbikribo@hotmail.com","rodrigo.sabbikribo","io44.D"
"Eric Lyzvoan","eric.lyzvoan@outlook.com","eric.lyzvoan",".c45.."
"Karina Ivete de França","karina.frança@outlook.com","karina.frança","ii33.."
"Ana da Silva Soavic","ana.soavic@hotmail.com","ana.soavic",".s45.."
"Mayara Maria Milani","mayara.milani@hotmail.com","mayara.milani","ry25.A"
"Edilene Kelly de Pereira da Paz","edilene.paz@outlook.com","edilene.paz","el54.L"
"Mariana de Pereira","mariana.pereira@bol.com.br","mariana.pereira","ai64.A"
"Gigi Maria dos Santos Giclivolgri Omajal","gigi.omajal@gmail.com","gigi.omajal","ii24.."
"Teresa Lara da Conceição Jardim de Paula","teresa.paula@outlook.com","teresa.paula","rr32.S"
"Ronaldo Moisés Iarnman Esrryson de Moura","ronaldo.moura@bol.com.br","ronaldo.moura","lo35.A"
"Wilma Dina de Noronha Milani","wilma.milani@hotmail.com","wilma.milani","mm55.A"
"Keyla de Souza","keyla.souza@outlook.com","keyla.souza","yl44.E"
"Michel Ysoman de Siqueira Júnior","michel.júnior@outlook.com","michel.júnior","ce43.H"
"Hildebrando de Lemos Osbavic","hildebrando.osbavic@outlook.com","hildebrando.osbavic","de62.L"
"Dina Zuleide Jangada de Lemes","dina.lemes@bol.com.br","dina.lemes","ai43.L"
"Charlene dos Pinhais Gomes","charlene.gomes@outlook.com","charlene.gomes","cl55.R"
"Samuel de Brandão Dutra","samuel.dutra@outlook.com","samuel.dutra","me35.U"
"João Refirn","joão.refirn@gmail.com","joão.refirn",".ã34.O"
"Natália Matilde de Sampaio do Paraná","natália.paraná@outlook.com","natália.paraná","lá45.T"
"Dante Grarnjaivic de Mendonça","dante.mendonça@outlook.com","dante.mendonça","en42.T"
"João Kisoka de Simões","joão.simões@bol.com.br","joão.simões","oo23.Ã"
"Rodrigo Eukogavic Sagu","rodrigo.sagu@hotmail.com","rodrigo.sagu","id35.G"
"Osvaldo de Noronha","osvaldo.noronha@msn.com","osvaldo.noronha","lv53.A"
"Wilson Ali Zascembizman Chira","wilson.chira@outlook.com","wilson.chira","os44.S"
"Sebastião Nathan de Mello","sebastião.mello@outlook.com","sebastião.mello","ae44.S"
"Paulo Patrick Brasil","paulo.brasil@bol.com.br","paulo.brasil","lu33.L"
"Vânia Núbia da Silva","vânia.silva@hotmail.com","vânia.silva","na42.I"
"Vinícius Isaías de Oliveira","vinícius.oliveira@outlook.com","vinícius.oliveira","cí44.Í"
"Vitor Cauê Rodrigues Júnior","vitor.júnior@msn.com","vitor.júnior","to33.T"
"Jairo Marco de Osório","jairo.osório@outlook.com","jairo.osório","ir43.R"
"Leo da Silva de Paranhos","leo.paranhos@msn.com","leo.paranhos","e.53.O"
"Elaine Luciana da Silva","elaine.silva@hotmail.com","elaine.silva","ei44.I"
"Túlio Jardim Aoma","túlio.aoma@outlook.com","túlio.aoma","il44.I"
"Edu Volaz","edu.volaz@outlook.com","edu.volaz","uv43.V"
"Alana de Albuquerque","alana.albuquerque@outlook.com","alana.albuquerque","nn43.N"
"Mel Solange de Souza Grogranpoz","mel.grogranpoz@hotmail.com","mel.grogranpoz","ll44.L"
"Heron Hildebrando Maoã","heron.maoã@outlook.com","heron.maoã","oe45.R"
"Wilma Samara Messol","wilma.messol@hotmail.com","wilma.messol","lm55.M"
"Jackson Ilmogarn de Souza","jackson.souza@bol.com.br","jackson.souza","ss64.K"
"Ademar Graeman Júnior","ademar.júnior@bol.com.br","ademar.júnior","me26.E"
"Hércules de Arruda Neto","hércules.neto@gmail.com","hércules.neto","cr45.C"
"Batista Eprickya da Gama","batista.gama@bol.com.br","batista.gama","is43.I"
"Quênia Adriana da Silva Rossi Garu","quênia.garu@hotmail.com","quênia.garu","ên35.U"
"Orlando Oeov","orlando.oeov@outlook.com","orlando.oeov","aa64.A"
"Samila Nicole Ipoecoson da Luz","samila.luz@bol.com.br","samila.luz","ii56.L"
"Nivaldo de Fernandes da Cruz","nivaldo.cruz@outlook.com","nivaldo.cruz","ad55.L"
"Susan de Chaves","susan.chaves@hotmail.com","susan.chaves","an44.A"
"Baltazar de Carvalho Júnior","baltazar.júnior@outlook.com","baltazar.júnior","lz34.A"
"Carla Talita de Alvarenga Jirehi","carla.jirehi@outlook.com","carla.jirehi","la34.L"
"Wally Oeol","wally.oeol@bol.com.br","wally.oeol","ll35.L"
"Raíssa de Borges Bauyuwa","raíssa.bauyuwa@gmail.com","raíssa.bauyuwa","sí42.R"
"Barnabé Pezu Bushitamo da Silva","barnabé.silva@gmail.com","barnabé.silva","ba52.A"
"Cristiano da Silva Gomes","cristiano.gomes@bol.com.br","cristiano.gomes","ts55.S"
"Karl dos Santos Cavalcante Waji","karl.waji@bol.com.br","karl.waji","w.54.L"
"Jaqueline do Piauí de Assis Yason","jaqueline.yason@outlook.com","jaqueline.yason","qu44.Q"
"Rose Rita de Antunes Maciel","rose.maciel@bol.com.br","rose.maciel","em34.S"
"Wally Barnabé do Piauí de Camargo","wally.camargo@bol.com.br","wally.camargo","ll43.L"
"Hilda de Paranhos","hilda.paranhos@gmail.com","hilda.paranhos","da43.L"
"Kiara Branco","kiara.branco@bol.com.br","kiara.branco","ii33.A"
"Adriana Catarina Nascrau","adriana.nascrau@outlook.com","adriana.nascrau","nn75.I"
"Alberto Joaquim de Oliveira","alberto.oliveira@outlook.com","alberto.oliveira","bb45.R"
"Martin Romo de Simões","martin.simões@outlook.com","martin.simões","it24.T"
"Tomáz Roger de Chaves Opro","tomáz.opro@bol.com.br","tomáz.opro","á.54.O"
"Vitor Joel Funi","vitor.funi@outlook.com","vitor.funi","or44.R"
"Orlando Eirn","orlando.eirn@bol.com.br","orlando.eirn","aa45.A"
"Rodrigo de Oliveira","rodrigo.oliveira@outlook.com","rodrigo.oliveira","id34.I"
"Suely Gutierrez","suely.gutierrez@hotmail.com","suely.gutierrez","le14.E"
"Marcelo de Rezende","marcelo.rezende@bol.com.br","marcelo.rezende","ce45.C"
"Solange Elisete de Trindade Moreno","solange.moreno@bol.com.br","solange.moreno","al45.G"
"Diogo Jorge de Ortega","diogo.ortega@msn.com","diogo.ortega","oo35.G"
"Hellen Couto","hellen.couto@outlook.com","hellen.couto","le54.L"
"Vanda Isabela Aconidizman Nazge Daisvic","vanda.daisvic@bol.com.br","vanda.daisvic","dd45.A"
"Nivaldo Guilherme Cinlean de Brandão","nivaldo.brandão@msn.com","nivaldo.brandão","ll54.V"
"Daniela Ísis Grisparn Rangel de Cardozo","daniela.cardozo@outlook.com","daniela.cardozo","in43.I"
"Jesus Shoi de Lisboa","jesus.lisboa@hotmail.com","jesus.lisboa","ss44.U"
"Juliano de Almeida","juliano.almeida@outlook.com","juliano.almeida","au46.I"
"Sabrina Lidiane de Brito Espada","sabrina.espada@outlook.com","sabrina.espada","rb45.B"
"Janete Roseli Gomes","janete.gomes@outlook.com","janete.gomes","nt45.T"
"Wilma Broem","wilma.broem@msn.com","wilma.broem","al44.M"
"Marilúcia Célia da Silva","marilúcia.silva@outlook.com","marilúcia.silva","li44.I"
"Beto da Paz de Barbosa","beto.barbosa@outlook.com","beto.barbosa","to65.T"
"Domingos Lino da Silva Asarnciryson","domingos.asarnciryson@outlook.com","domingos.asarnciryson","mm54.M"
"Ariel Eleriane Kogu","ariel.kogu@outlook.com","ariel.kogu","el44.E"
"Juliano Wagner Vacis Kizebu","juliano.kizebu@outlook.com","juliano.kizebu","il43.I"
"Barnabé de Ferraz","barnabé.ferraz@bol.com.br","barnabé.ferraz","an53.N"
"Martinho Lúcio dos Santos","martinho.santos@outlook.com","martinho.santos","tr44.I"
"Josiane Epoa Mobezopi","josiane.mobezopi@bol.com.br","josiane.mobezopi","as55.I"
"Luiz Dionísio de Souza Kuwauwa","luiz.kuwauwa@bol.com.br","luiz.kuwauwa",".i41.Z"
"César Luiz da Silva","césar.silva@bol.com.br","césar.silva","..15.A"
"Manuel de Araújo","manuel.araújo@hotmail.com","manuel.araújo","ua43.U"
"Meire da Costa Ifye","meire.ifye@msn.com","meire.ifye","ri45.R"
"Eduarda Repi","eduarda.repi@outlook.com","eduarda.repi","ra54.U"
"Telma Branco","telma.branco@outlook.com","telma.branco","aa54.."
"Arthur da Silva","arthur.silva@bol.com.br","arthur.silva","tu64.U"
"Clotilde Franco","clotilde.franco@bol.com.br","clotilde.franco","ii35.L"
"Davi Lornluov","davi.lornluov@hotmail.com","davi.lornluov","lv44.V"
"Otávia de Lins","otávia.lins@hotmail.com","otávia.lins","vv46.T"
"João Roberto Castelo","joão.castelo@hotmail.com","joão.castelo","o.34.C"
"Hugo Ramon de Ayres","hugo.ayres@outlook.com","hugo.ayres","ug35.G"
"Charlene Sino","charlene.sino@outlook.com","charlene.sino","ra45.R"
"Dante Sérgio Fralithiason","dante.fralithiason@outlook.com","dante.fralithiason","an56.N"
"Damião de Sampaio Valverde","damião.valverde@bol.com.br","damião.valverde","ii33.O"
"Gislaine Jaqueline Chauge de Mello","gislaine.mello@hotmail.com","gislaine.mello","as24.L"
"Saulo Maurício Couto","saulo.couto@hotmail.com","saulo.couto","lo43.."
"Alan Kafubi Moaozbri","alan.moaozbri@bol.com.br","alan.moaozbri","nn44.L"
"Quitéria Anne de Lisboa da Silva do Prado","quitéria.prado@bol.com.br","quitéria.prado","éé54.T"
"Wilson Uarn Dashibun Neto","wilson.neto@gmail.com","wilson.neto","ls35.L"
"Toninho Manoel Tifofinozvic Torres","toninho.torres@outlook.com","toninho.torres","oi23.N"
"Gigi de Santana da Silva","gigi.silva@hotmail.com","gigi.silva","si53.S"
"Túlio Nelson da Silva de Alvim","túlio.alvim@gmail.com","túlio.alvim","il43.I"
"Túlio Espada de Campos Júnior","túlio.júnior@outlook.com","túlio.júnior","io34.I"
"Mayara Dina Emal Cocrivic","mayara.cocrivic@outlook.com","mayara.cocrivic","ra65.A"
"Henrique Emílio Tufelu de Souza da Encarnação","henrique.encarnação@outlook.com","henrique.encarnação","ii33.N"
"Elano Raul Portugal","elano.portugal@outlook.com","elano.portugal","nn22.N"
"Cirilo Wirngascau","cirilo.wirngascau@bol.com.br","cirilo.wirngascau","ri54.I"
"Toninho Martinez","toninho.martinez@outlook.com","toninho.martinez","nn55.N"
"Leo Goplasvic Ifranão Neto","leo.neto@hotmail.com","leo.neto",".o55.T"
"Xerxes Cléber Azchu","xerxes.azchu@hotmail.com","xerxes.azchu","sx35.S"
"Paula de Oliveira","paula.oliveira@outlook.com","paula.oliveira","uu66.L"
"Marina Cleuza Garnulaman","marina.garnulaman@outlook.com","marina.garnulaman","ar56.I"
"Suellen Juliana Aodos de São Pedro","suellen.pedro@hotmail.com","suellen.pedro","el43.L"
"Catarina dos Santos Kasuzete","catarina.kasuzete@outlook.com","catarina.kasuzete","ra54.A"
"Jaqueline Iepam","jaqueline.iepam@bol.com.br","jaqueline.iepam","ue43.E"
"Otávia Coutinho","otávia.coutinho@outlook.com","otávia.coutinho","iv16.Á"
"José de Cabral","josé.cabral@hotmail.com","josé.cabral","éc23.S"
"Júlio Ricardo Zudawoga","júlio.zudawoga@outlook.com","júlio.zudawoga","lo55.I"
"Nádia Borba Difil","nádia.difil@bol.com.br","nádia.difil","id34.A"
"João Imiencezvic","joão.imiencezvic@bol.com.br","joão.imiencezvic","oo24.Ã"
"Cíntia Valeska Portugal Marinho","cíntia.marinho@bol.com.br","cíntia.marinho","ii25.N"
"Ciro Danilo Yvulam","ciro.yvulam@outlook.com","ciro.yvulam","o.53.O"
"Albina Viviane de Osório","albina.osório@outlook.com","albina.osório","in25.N"
"Anne Vanda Lulse Pires","anne.pires@hotmail.com","anne.pires","a.44.E"
"Romildo Luan da Silva","romildo.silva@bol.com.br","romildo.silva","ll54.I"
"Willian Dionísio Castelo Branco","willian.branco@hotmail.com","willian.branco","ll43.I"
"Shirley Tristão","shirley.tristão@hotmail.com","shirley.tristão","ii44.L"
"Alan dos Santos da Silva","alan.silva@outlook.com","alan.silva",".n53.A"
"Gilmar Valverde","gilmar.valverde@msn.com","gilmar.valverde","lm55.A"
"Benedito Gomes de Morais Júnior","benedito.júnior@bol.com.br","benedito.júnior","ee34.E"
"Fagner Moisés da Silva Júnior","fagner.júnior@bol.com.br","fagner.júnior","ng33.E"
"Benedito Willian de Souza Valente Dutra","benedito.dutra@outlook.com","benedito.dutra","ee24.E"
"Bella de Brito","bella.brito@hotmail.com","bella.brito","ll54.L"
"Nayara Milene de Drummond Weiss","nayara.weiss@outlook.com","nayara.weiss","ar43.R"
"Aldo Carlos da Silva de Rezende","aldo.rezende@outlook.com","aldo.rezende","do54.O"
"Bento Thiago de Cardozo Dazubata Júnior","bento.júnior@outlook.com","bento.júnior","tt44.T"
"Fernanda Mineiro","fernanda.mineiro@bol.com.br","fernanda.mineiro","na45.R"
"José Amarildo Espada de Junqueira","josé.junqueira@hotmail.com","josé.junqueira","ss44.S"
"Margarete de Pascoal da Paixão Ouov","margarete.ouov@bol.com.br","margarete.ouov","gr42.A"
"Marcielle Marielle de Freitas","marcielle.freitas@bol.com.br","marcielle.freitas","cr44.C"
"Heitor Craismmuco de Souza","heitor.souza@hotmail.com","heitor.souza","ii43.T"
"Flávia Laís Warou da Paraíba Aoiman","flávia.aoiman@bol.com.br","flávia.aoiman","ii33.V"
"Hilda Gromeov de Leão Weber","hilda.weber@msn.com","hilda.weber","ad32.A"
"Maria de Tozetto da Silva Couto","maria.couto@hotmail.com","maria.couto","ri45.A"
"Rosa da Silva","rosa.silva@bol.com.br","rosa.silva","s.54.A"
"Maria Dutra","maria.dutra@hotmail.com","maria.dutra","ia25.R"
"Margarida Mônica de Cerqueira dos Reis","margarida.reis@bol.com.br","margarida.reis","aa24.R"
"Juliano Rodrigo Estrada de Barros da Cunha Júnior","juliano.júnior@outlook.com","juliano.júnior","ui54.L"
"Andressa de Souza Tezosoto Gokupehe","andressa.gokupehe@msn.com","andressa.gokupehe","rr44.R"
"Juliano Leopoldo de Gusmão do Prado","juliano.prado@hotmail.com","juliano.prado","li44.A"
"Eloá Dovlison","eloá.dovlison@outlook.com","eloá.dovlison","áo35.L"
"Nicolau Valverde","nicolau.valverde@hotmail.com","nicolau.valverde","oo34.L"
"Heitor de Souza","heitor.souza@outlook.com","heitor.souza","ei63.I"
"Soraya de Lisboa","soraya.lisboa@hotmail.com","soraya.lisboa","ra43.A"
"Lara de Macedo dos Santos","lara.santos@hotmail.com","lara.santos",".a53.A"
"Janaína de São Pedro Maciel","janaína.maciel@bol.com.br","janaína.maciel","ía44.A"
"Manuel Agrason Gomes Rodrigues","manuel.rodrigues@hotmail.com","manuel.rodrigues","un44.E"
"João Marcelo Couto","joão.couto@bol.com.br","joão.couto","ão23.Ã"
"Oliver Nosto Bide Júnior","oliver.júnior@hotmail.com","oliver.júnior","ev44.I"
"Albina Afraziuman da Serra Yupukefu","albina.yupukefu@outlook.com","albina.yupukefu","ia55.B"
"Ariana de Pereira Dozebe","ariana.dozebe@bol.com.br","ariana.dozebe","aa34.A"
"Heron Martin de Figueiredo","heron.figueiredo@bol.com.br","heron.figueiredo","rn34.R"
"Zenaide Leonara Elome","zenaide.elome@outlook.com","zenaide.elome","in45.A"
"Maria Otávia Envuasboan dos Santos","maria.santos@outlook.com","maria.santos","ia66.I"
"Mariano Alisson da Silva Júnior","mariano.júnior@bol.com.br","mariano.júnior","ra45.I"
"Wilma de Torquato Jardim","wilma.jardim@hotmail.com","wilma.jardim","m.45.M"
"Gislaine Gomes","gislaine.gomes@hotmail.com","gislaine.gomes","ls42.A"
"Pedro de Assis","pedro.assis@outlook.com","pedro.assis","ed45.R"
"João Olavo Pinhão de Paiva Jangada Neto","joão.neto@outlook.com","joão.neto",".o64.."
"Andréia Marques","andréia.marques@bol.com.br","andréia.marques","éd44.D"
"Vívian de Leão Torres","vívian.torres@bol.com.br","vívian.torres","iv42.I"
"Cristiane Daiane de Ortega Maciel","cristiane.maciel@outlook.com","cristiane.maciel","it24.S"
"Nair Euer","nair.euer@gmail.com","nair.euer",".a35.."
"Yeda Gigi Iesrre Ernu Ymsu","yeda.ymsu@outlook.com","yeda.ymsu","aa25.A"
"Décio Wagner da Gama de Oliveira","décio.oliveira@outlook.com","décio.oliveira","éi55.C"
"Cléber Gomes","cléber.gomes@outlook.com","cléber.gomes","eb45.B"
"Kim Schneider Júnior","kim.júnior@hotmail.com","kim.júnior","mj53.."
"Cíntia Karina Eneciã da Silva Focri","cíntia.focri@outlook.com","cíntia.focri","in24.I"
"Ana Poliana Teles de Paranhos","ana.paranhos@hotmail.com","ana.paranhos","a.54.P"
"Diana Madalena dos Santos","diana.santos@outlook.com","diana.santos",".a54.A"
"Beatriz Burahaka de Braga","beatriz.braga@outlook.com","beatriz.braga","rr44.A"
"Aline Eioer","aline.eioer@hotmail.com","aline.eioer","ne32.."
"Eliel Jesus Crimdoer Pugonebu","eliel.pugonebu@bol.com.br","eliel.pugonebu","il56.E"
"Laerte de Matos Yzmeason","laerte.yzmeason@hotmail.com","laerte.yzmeason","re64.R"
"Laerte Marciano Ribeiro Rodrigues","laerte.rodrigues@gmail.com","laerte.rodrigues","te43.R"
"Ana Povy Nakimito","ana.nakimito@outlook.com","ana.nakimito","na55.N"
"Zara Meire Freire","zara.freire@bol.com.br","zara.freire","fr46.A"
"Giovanni de Campos Júnior","giovanni.júnior@outlook.com","giovanni.júnior","oo57.O"
"Robson de Souza Ntsu Vigoa","robson.vigoa@bol.com.br","robson.vigoa","so44.S"
"Rebeca Xilena dos Santos de Souza","rebeca.souza@hotmail.com","rebeca.souza",".b46.B"
"Omar Armando da Silva Bazanu","omar.bazanu@outlook.com","omar.bazanu","ar54.A"
"Jean Aerndlo de Oliveira Banhos","jean.banhos@gmail.com","jean.banhos","ne35.N"
"Júlio Josiel Uwocleson","júlio.uwocleson@bol.com.br","júlio.uwocleson","úo24.I"
"Sara dos Santos","sara.santos@msn.com","sara.santos","r.53.."
"Simone Olkue","simone.olkue@bol.com.br","simone.olkue","on53.I"
"Edivaldo César Martinez","edivaldo.martinez@outlook.com","edivaldo.martinez","lv43.A"
"Fátima de Barbosa Elcovic","fátima.elcovic@outlook.com","fátima.elcovic","aa23.I"
"Bruna de Souza Gaeo","bruna.gaeo@gmail.com","bruna.gaeo","au34.U"
"Uribe Herrera","uribe.herrera@bol.com.br","uribe.herrera",".r52.B"
"Margarete Rute da Mata do Espírito Santo","margarete.santo@outlook.com","margarete.santo","aa33.G"
"Maria Vânia de Sampaio","maria.sampaio@hotmail.com","maria.sampaio","ri32.I"
"Denis Anderson de Queiroz","denis.queiroz@hotmail.com","denis.queiroz","ns44.S"
"André de Souza Júnior","andré.júnior@outlook.com","andré.júnior",".r45.R"
"Hilda Klein Moboze","hilda.moboze@hotmail.com","hilda.moboze","la24.D"
"Celso Robert Bere Júnior","celso.júnior@outlook.com","celso.júnior","lc35.S"
"Joaquim Orlando Pires","joaquim.pires@hotmail.com","joaquim.pires","aa34.U"
"Gilberto Jardel de Sales da Silva","gilberto.silva@msn.com","gilberto.silva","ei44.B"
"Samara Cecília Arndro","samara.arndro@outlook.com","samara.arndro","ma35.M"
"Alberto Elói da Silva Câmara","alberto.câmara@bol.com.br","alberto.câmara","el45.R"
"Daiane de Pinheiro","daiane.pinheiro@gmail.com","daiane.pinheiro","ni44.N"
"Dionísio de Diniz","dionísio.diniz@outlook.com","dionísio.diniz","nn65.I"
"Avelino Gilson da Silva Drirngaer","avelino.drirngaer@hotmail.com","avelino.drirngaer","le74.I"
"Jorge Góis de Uchôa","jorge.uchôa@hotmail.com","jorge.uchôa","gg44.E"
"Otávio Israel de Diniz","otávio.diniz@msn.com","otávio.diniz","it33.Á"
"Madalena Úrsula Gesiz","madalena.gesiz@hotmail.com","madalena.gesiz","ll35.D"
"Verônica Dine Mavio","verônica.mavio@outlook.com","verônica.mavio","rô43.R"
"Nilton da Silva de Farias Eorndoce","nilton.eorndoce@bol.com.br","nilton.eorndoce","tt53.O"
"Dionísio de Ortiz Matsuina","dionísio.matsuina@outlook.com","dionísio.matsuina","oo43.O"
"Gabriel Pimenta Terceiro","gabriel.terceiro@hotmail.com","gabriel.terceiro","rr54.A"
"Thiago Udreman Jangada","thiago.jangada@bol.com.br","thiago.jangada","ii34.."
"Selma Eliane dos Santos","selma.santos@outlook.com","selma.santos","am55.M"
"Neila Eleonora Rosatto","neila.rosatto@hotmail.com","neila.rosatto","aa44.A"
"Antônio Dário da Cunha de Jesus","antônio.jesus@hotmail.com","antônio.jesus","ôô34.Ô"
"Ezequiel Walter de Angola Guedes Jardim","ezequiel.jardim@msn.com","ezequiel.jardim","qq33.U"
