"nome","email","login","senha"
"Eliomar Gomes","eliomar.gomes@hotmail.com","eliomar.gomes","ii44.E"
"Sebastião Altino de Junqueira Onziflo","sebastião.onziflo@outlook.com","sebastião.onziflo","sa65.A"
"Eliomar da Silva","eliomar.silva@msn.com","eliomar.silva","rr34.O"
"Soraya dos Santos de Ortiz","soraya.ortiz@outlook.com","soraya.ortiz","aa34.A"
"Maria Rosilda Negrão","maria.negrão@outlook.com","maria.negrão","ii55.A"
"Jesus Humberto Torres de Iglesias","jesus.iglesias@msn.com","jesus.iglesias","u.54.S"
"Patrícia Weber Buarque","patrícia.buarque@outlook.com","patrícia.buarque","tr34.Í"
"Zuleide Kiara de Oliveira","zuleide.oliveira@hotmail.com","zuleide.oliveira","le44.D"
"Diana Rosângela Gogozago Olusbli","diana.olusbli@hotmail.com","diana.olusbli","aa44.N"
"Maria Okizov","maria.okizov@outlook.com","maria.okizov","rr46.I"
"Sara Tainá de Viana Oalo","sara.oalo@bol.com.br","sara.oalo","aa43.."
"Felipe Milton Ocosina","felipe.ocosina@outlook.com","felipe.ocosina","pl45.P"
"Cristiano Habunuzo Neto","cristiano.neto@outlook.com","cristiano.neto","ti55.S"
"Rosimeire Erna de Padilha","rosimeire.padilha@outlook.com","rosimeire.padilha","ss44.E"
"Aldo Celso de Leite da Costa","aldo.costa@hotmail.com","aldo.costa",".o33.O"
"Kelly da Silva","kelly.silva@msn.com","kelly.silva","ly44.L"
"Suely Thaís de Souza Nute","suely.nute@outlook.com","suely.nute",".l42.Y"
"Xavier Karl Ribeiro Amoiszo","xavier.amoiszo@gmail.com","xavier.amoiszo","vv54.A"
"Suzanne Tatiana de São Pedro da Silva","suzanne.silva@bol.com.br","suzanne.silva","nu55.Z"
"Jonathan Edson Gauson de Martins","jonathan.martins@outlook.com","jonathan.martins","aa54.A"
"Luís de Alencar","luís.alencar@hotmail.com","luís.alencar","..33.S"
"Martinho de Martins Sesa","martinho.sesa@outlook.com","martinho.sesa","tr43.T"
"Everaldo Zeme","everaldo.zeme@hotmail.com","everaldo.zeme","ea63.A"
"Marcela Leila Klein","marcela.klein@hotmail.com","marcela.klein","ec46.A"
"Israel Gilson de Silveira Júnior","israel.júnior@hotmail.com","israel.júnior","rr54.R"
"Velma do Amazonas de Amorim","velma.amorim@gmail.com","velma.amorim","am44.E"
"Terezinha Lígia Sakita Gomes","terezinha.gomes@bol.com.br","terezinha.gomes","ee43.R"
"Bernardo de Muniz Júnior","bernardo.júnior@outlook.com","bernardo.júnior","rr56.N"
"Gabrielle Lana Oiaulã","gabrielle.oiaulã@hotmail.com","gabrielle.oiaulã","rr44.R"
"Bernardo Maurício Botoyu de Pinheiro da Silva","bernardo.silva@bol.com.br","bernardo.silva","rr53.N"
"Rodrigo Rosa da Silva Júnior","rodrigo.júnior@outlook.com","rodrigo.júnior","rd54.I"
"Jenny Jaqueline Shirini","jenny.shirini@outlook.com","jenny.shirini","nn43.N"
"Alan de Espanha Cruilã Júnior","alan.júnior@bol.com.br","alan.júnior",".n44.A"
"Lana Oniman do Paraná","lana.paraná@bol.com.br","lana.paraná","aa53.."
"Nicolau de Bragança Gomfavou","nicolau.gomfavou@bol.com.br","nicolau.gomfavou","ol34.O"
"Ângelo Gagi","ângelo.gagi@bol.com.br","ângelo.gagi","lg42.G"
"Elano Frederico de Mendonça","elano.mendonça@bol.com.br","elano.mendonça","na44.O"
"Poliana Vanda Irni","poliana.irni@outlook.com","poliana.irni","al45.O"
"Aldo Pires","aldo.pires@outlook.com","aldo.pires","op64.D"
"Bete Brasil de Gusmões","bete.gusmões@outlook.com","bete.gusmões","et53.E"
"Ana Anne Werner Valente","ana.valente@hotmail.com","ana.valente","va53.V"
"Guilherme Edinaldo da Silva de Barbosa","guilherme.barbosa@outlook.com","guilherme.barbosa","hi54.L"
"Jonathan Igor de Paula da Cruz Bigone","jonathan.bigone@hotmail.com","jonathan.bigone","aa43.A"
"Natália Alana Pakehi","natália.pakehi@msn.com","natália.pakehi","la33.A"
"Gislaine Rute Terntonson","gislaine.terntonson@bol.com.br","gislaine.terntonson","ls23.L"
"Tomáz da Paixão","tomáz.paixão@hotmail.com","tomáz.paixão","zm54.Á"
"Fabíola Adriana de Assunção","fabíola.assunção@outlook.com","fabíola.assunção","bl42.Í"
"Marlon Zoshiki","marlon.zoshiki@outlook.com","marlon.zoshiki","al45.O"
"Valéria Tilvumniman Tilovanel","valéria.tilovanel@bol.com.br","valéria.tilovanel","lr53.L"
"Henrique de Gonçalves Afabbo Yoyamo","henrique.yoyamo@outlook.com","henrique.yoyamo","ir55.R"
"Keyla Raíssa Oklin","keyla.oklin@outlook.com","keyla.oklin","aa44.A"
"Cauê de Barbosa Gosyvic","cauê.gosyvic@outlook.com","cauê.gosyvic","uu54.Ê"
"Paulo Asewofu de Borges","paulo.borges@outlook.com","paulo.borges","oo44.L"
"Francisco Kauê Castelo Drunuseman","francisco.drunuseman@bol.com.br","francisco.drunuseman","cn54.C"
"Patrícia de Ortega","patrícia.ortega@outlook.com","patrícia.ortega","íí44.R"
"Heloísa Rafaela de Braga","heloísa.braga@msn.com","heloísa.braga","oo54.O"
"Roseli Dina da Silva","roseli.silva@gmail.com","roseli.silva","ee42.S"
"Suzana Elisa de Camargo Runoklirn","suzana.runoklirn@bol.com.br","suzana.runoklirn","aa32.A"
"Tainara Mirela de Oliveira da Silva Fontes","tainara.fontes@outlook.com","tainara.fontes","ar45.N"
"Mayra de Cardozo Lopes","mayra.lopes@outlook.com","mayra.lopes","rr34.A"
"Flaviana Gomes","flaviana.gomes@outlook.com","flaviana.gomes","av34.V"
"Charlene de Barbosa Clean Oagu","charlene.oagu@hotmail.com","charlene.oagu","la43.R"
"Marciane Rebeca Pomrelman de Fonseca","marciane.fonseca@outlook.com","marciane.fonseca","ir53.C"
"Ney de Chaves","ney.chaves@hotmail.com","ney.chaves",".y25.."
"Albano Ederson Ivalman","albano.ivalman@hotmail.com","albano.ivalman","bl67.A"
"Tainara Amurnão de Barbosa","tainara.barbosa@outlook.com","tainara.barbosa","aa34.A"
"Táles Marques da Silva Pires Neto","táles.neto@outlook.com","táles.neto","ls44.E"
"Felícia Cláudia de Ortega Brayu Branco","felícia.branco@outlook.com","felícia.branco","ec34.Í"
"Charles Lino de Barbosa Impiov","charles.impiov@bol.com.br","charles.impiov","rl33.H"
"Cirilo Aloísio Shiyubusu de Figueira","cirilo.figueira@msn.com","cirilo.figueira","rr43.I"
"Ana de Amorim","ana.amorim@outlook.com","ana.amorim",".a35.A"
"Lidiane Patrícia Martinez","lidiane.martinez@gmail.com","lidiane.martinez","ni33.I"
"Vitor Breno de Campos Ikre","vitor.ikre@bol.com.br","vitor.ikre",".o55.T"
"Cícero Rodolfo Serensu","cícero.serensu@hotmail.com","cícero.serensu","er54.E"
"Nivaldo Marco Muna da Mata","nivaldo.mata@hotmail.com","nivaldo.mata","av53.V"
"Fabíola Glaoan","fabíola.glaoan@bol.com.br","fabíola.glaoan","ob33.O"
"Edson Kauê de Camargo","edson.camargo@outlook.com","edson.camargo","oo45.N"
"Clarice Graziele Branco","clarice.branco@hotmail.com","clarice.branco","lr45.A"
"Graziele Cleuza de Tavares","graziele.tavares@outlook.com","graziele.tavares","za55.I"
"Mike Tosyo","mike.tosyo@outlook.com","mike.tosyo","ke54.K"
"Nilo Mike Ilbaer Ogriman","nilo.ogriman@outlook.com","nilo.ogriman","ll54.O"
"Otávia Uoaban","otávia.uoaban@outlook.com","otávia.uoaban","ii52.V"
"Yolanda de Fonseca Bafuni","yolanda.bafuni@outlook.com","yolanda.bafuni","an35.A"
"Fagner de Sales","fagner.sales@bol.com.br","fagner.sales","ne45.E"
"Sabrina Chibinho","sabrina.chibinho@outlook.com","sabrina.chibinho","ri45.B"
"Karin Maciel","karin.maciel@outlook.com","karin.maciel",".i54.I"
"Jonas Ribi Nunes Eyze","jonas.eyze@bol.com.br","jonas.eyze","so44.J"
"Frederico Nishiraha","frederico.nishiraha@outlook.com","frederico.nishiraha","dr54.E"
"Uribe Otaviano da Silva","uribe.silva@outlook.com","uribe.silva","be35.B"
"Denis Eaman Neto","denis.neto@bol.com.br","denis.neto","ne25.I"
"Sheila Andréia Lossi","sheila.lossi@bol.com.br","sheila.lossi","al55.E"
"Velma Lígia de Sampaio","velma.sampaio@bol.com.br","velma.sampaio","aa55.M"
"Suzanne Lirimshuman","suzanne.lirimshuman@outlook.com","suzanne.lirimshuman","zn55.A"
"Adônis Fabrício Ogrie de Siqueira","adônis.siqueira@hotmail.com","adônis.siqueira","nn54.Ô"
"Alan Milani","alan.milani@bol.com.br","alan.milani","na34.L"
"Andréia Mineiro","andréia.mineiro@hotmail.com","andréia.mineiro","né32.R"
"Cleberson de Lima Criaman Júnior","cleberson.júnior@msn.com","cleberson.júnior","ee45.E"
"Damião Giuseppe da Luz","damião.luz@msn.com","damião.luz","ãm46.Ã"
"Paulo Ângelo dos Pinhais","paulo.pinhais@outlook.com","paulo.pinhais","ou36.U"
"Roseli de Barbosa Weber Vaz","roseli.vaz@hotmail.com","roseli.vaz","el55.E"
"Dionísio Manoel de Novais","dionísio.novais@hotmail.com","dionísio.novais","on35.Í"
"Larissa de Antunes Moreno","larissa.moreno@outlook.com","larissa.moreno","si35.S"
"Melissa Rosa dos Santos","melissa.santos@outlook.com","melissa.santos","ie55.I"
"Amarildo Estrada","amarildo.estrada@outlook.com","amarildo.estrada","ir54.R"
"Wagner Hahori Lopes","wagner.lopes@hotmail.com","wagner.lopes","nn34.N"
"Mateus da Silva Thagrier de Gonçalves","mateus.gonçalves@outlook.com","mateus.gonçalves","es34.U"
"Humberto Roger dos Santos de Munhoz","humberto.munhoz@hotmail.com","humberto.munhoz","rb44.B"
"Caio Francisco de Moura","caio.moura@gmail.com","caio.moura",".o44.."
"Poliana Renata Chimuowa de Ayres Usai","poliana.usai@outlook.com","poliana.usai","ai45.I"
"Eulália Empaman","eulália.empaman@bol.com.br","eulália.empaman","iá52.Á"
"Dionísio Hara","dionísio.hara@hotmail.com","dionísio.hara","no35.Í"
"Renato Gutierrez","renato.gutierrez@bol.com.br","renato.gutierrez","na33.T"
"Fabíola Aerni Sugeu Fislomeson","fabíola.fislomeson@gmail.com","fabíola.fislomeson","bo45.B"
"Jacinto de Bueno","jacinto.bueno@outlook.com","jacinto.bueno","cn44.I"
"Margarete Keyla Iaman de Santana Ximenes","margarete.ximenes@bol.com.br","margarete.ximenes","ar33.A"
"Joelma Cícera de Jesus Sadrellamgyrnson","joelma.sadrellamgyrnson@outlook.com","joelma.sadrellamgyrnson","ml44.E"
"Estevão Benedito Preto Pobason","estevão.pobason@outlook.com","estevão.pobason","tv34.T"
"Marcelo Elias Vracloi da Silva","marcelo.silva@hotmail.com","marcelo.silva","cr36.E"
"Uribe Aldo Asalhes Errasov de Mello","uribe.mello@hotmail.com","uribe.mello","rb43.B"
"Raí da Silva","raí.silva@hotmail.com","raí.silva","..62.S"
"Michel Manoel de Diniz","michel.diniz@outlook.com","michel.diniz","he43.I"
"Nicole Mara Weber dos Santos","nicole.santos@hotmail.com","nicole.santos","oe56.L"
"Quitéria Suzana de Pereira","quitéria.pereira@outlook.com","quitéria.pereira","éé43.I"
"Ariel Andréia Torres dos Santos de Viana","ariel.viana@outlook.com","ariel.viana","re55.E"
"Jonathas de Bragança Neto","jonathas.neto@msn.com","jonathas.neto","na55.A"
"Zulmira Raquel de Tavares","zulmira.tavares@hotmail.com","zulmira.tavares","mm64.I"
"Laura Célia Husseka Klai","laura.klai@outlook.com","laura.klai","au35.R"
"Ísis de Oliveira","ísis.oliveira@outlook.com","ísis.oliveira","s.53.S"
"Simão Pozdi","simão.pozdi@hotmail.com","simão.pozdi","mã65.O"
"Ricardo Chijisea","ricardo.chijisea@outlook.com","ricardo.chijisea","ci35.A"
"Romildo de Jesus Zogu Neto","romildo.neto@bol.com.br","romildo.neto","oi55.M"
"Manuela Mara Beperra","manuela.beperra@outlook.com","manuela.beperra","an45.A"
"Rosa Bruna de Barboza","rosa.barboza@outlook.com","rosa.barboza",".a52.S"
"Violeta Gigi de Iglesias","violeta.iglesias@outlook.com","violeta.iglesias","le54.T"
"Emílio de Assis Jardim dos Santos","emílio.santos@gmail.com","emílio.santos","íi43.I"
"Alessandra Luiza Eylirnjuson de Oliveira Gomes","alessandra.gomes@bol.com.br","alessandra.gomes","ss34.S"
"Sabrina Ire Oaov de Linhares","sabrina.linhares@hotmail.com","sabrina.linhares","ri45.B"
"Gilmar de Souza Ernilmavic","gilmar.ernilmavic@bol.com.br","gilmar.ernilmavic","al23.M"
"Zenaide Patrícia de Sobral Shinu","zenaide.shinu@msn.com","zenaide.shinu","ie36.A"
"Genir Lígia de Braga","genir.braga@hotmail.com","genir.braga","rn44.I"
"Brenda Paulínia Gutierrez","brenda.gutierrez@bol.com.br","brenda.gutierrez","nn16.A"
"Jéssica da Paixão","jéssica.paixão@outlook.com","jéssica.paixão","ss55.I"
"Dário Félix Mercado","dário.mercado@gmail.com","dário.mercado","rm35.I"
"Marciano Sygro Tlyuas do Piauí Júnior","marciano.júnior@gmail.com","marciano.júnior","cc36.C"
"José Maurício Kinfezlu de Álvares","josé.álvares@gmail.com","josé.álvares","éé43.É"
"Raí Milton de Oliveira da Silva","raí.silva@hotmail.com","raí.silva","aí33.."
"Eloá Uyja Trevisan Emuão","eloá.emuão@hotmail.com","eloá.emuão","el45.O"
"Lucas Womaiman","lucas.womaiman@bol.com.br","lucas.womaiman","as44.A"
"Henrique Efezson","henrique.efezson@msn.com","henrique.efezson","rn46.I"
"Jéssica Alana de Britto","jéssica.britto@hotmail.com","jéssica.britto","ss45.S"
"Hildebrando da Silva de Muniz","hildebrando.muniz@bol.com.br","hildebrando.muniz","le43.D"
"João Luke Emceov Lopes","joão.lopes@bol.com.br","joão.lopes","lo43.."
"Anderson Reginaldo Sarome de Vieira","anderson.vieira@outlook.com","anderson.vieira","dn44.S"
"Albina de Noronha Portugal Teyogi","albina.teyogi@hotmail.com","albina.teyogi","bi55.I"
"Celso Dopoão da Silva Beolman","celso.beolman@outlook.com","celso.beolman","ls64.E"
"Eliane da Silva","eliane.silva@outlook.com","eliane.silva","nn44.A"
"Albina Evelyn de Aguiar","albina.aguiar@bol.com.br","albina.aguiar","ib43.I"
"Reinaldo Wally de Lacerda","reinaldo.lacerda@outlook.com","reinaldo.lacerda","aa53.N"
"Arthur Mineiro","arthur.mineiro@bol.com.br","arthur.mineiro","ut63.H"
"Joel de Pereira","joel.pereira@outlook.com","joel.pereira","ll44.E"
"Domingos de Gonçalves","domingos.gonçalves@bol.com.br","domingos.gonçalves","mm45.G"
"Damares Francielle Oihuão Anpuospe","damares.anpuospe@hotmail.com","damares.anpuospe","aa44.M"
"Demilson Kuzamaki Júnior","demilson.júnior@hotmail.com","demilson.júnior","im44.M"
"Gilberto da Silva Neto","gilberto.neto@yahoo.com","gilberto.neto","bb54.B"
"Ciro Pires de Pereira","ciro.pereira@outlook.com","ciro.pereira","r.43.O"
"Ariana de Mendonça Dutra","ariana.dutra@outlook.com","ariana.dutra","ni64.N"
"Ana de Souza Netoyo","ana.netoyo@bol.com.br","ana.netoyo","..23.."
"Úrsula Azemvic de São Pedro","úrsula.pedro@outlook.com","úrsula.pedro","lr55.S"
"Nair Tainá Freire","nair.freire@bol.com.br","nair.freire","ri45.."
"Geraldo Luke Rely da Lira","geraldo.lira@outlook.com","geraldo.lira","ra34.E"
"Jair da Silva","jair.silva@outlook.com","jair.silva","j.64.."
"Aloísio Fernando Sugayu Kora","aloísio.kora@outlook.com","aloísio.kora","ís54.L"
"Suzy Mariana de Freitas","suzy.freitas@outlook.com","suzy.freitas",".y34.Y"
"Selena Rernaty","selena.rernaty@msn.com","selena.rernaty","nl35.N"
"Benedito Jonathan Lopes","benedito.lopes@hotmail.com","benedito.lopes","di43.D"
"Robson de Torquato Moma Ucri Júnior","robson.júnior@hotmail.com","robson.júnior","on24.O"
"André Barnabé Watsuano","andré.watsuano@outlook.com","andré.watsuano","rn53.É"
"Junior Geraldo de Siqueira","junior.siqueira@outlook.com","junior.siqueira","oo25.N"
"Felícia Patrícia Shiro","felícia.shiro@outlook.com","felícia.shiro","lc54.C"
"Kátia dos Santos de Cabral Klein","kátia.klein@outlook.com","kátia.klein","ti44.A"
"Kim Ismael Vejogasoz de Barbosa Mercado","kim.mercado@hotmail.com","kim.mercado","e.46.."
"Elisete Eunice dos Santos","elisete.santos@bol.com.br","elisete.santos","ee33.E"
"Lino Fybalan","lino.fybalan@outlook.com","lino.fybalan","fn54.O"
"Luigi Karl Yarabo de Machado","luigi.machado@hotmail.com","luigi.machado","ig34.I"
"Celina de Soares da Costa","celina.costa@outlook.com","celina.costa","en24.I"
"Ariel de Simões","ariel.simões@outlook.com","ariel.simões","le45.I"
"Cirilo Adriano Buarque Bago de Ortega","cirilo.ortega@bol.com.br","cirilo.ortega","il53.L"
"Henrique Albano Marinho","henrique.marinho@outlook.com","henrique.marinho","nn52.E"
"Aldo Juan Gomes de Abreu","aldo.abreu@bol.com.br","aldo.abreu",".d54.O"
"Washington Uribe Weber","washington.weber@outlook.com","washington.weber","is44.G"
"Barnabé Prapason","barnabé.prapason@outlook.com","barnabé.prapason","nn44.A"
"Olívia Adrielle Sunotlan","olívia.sunotlan@outlook.com","olívia.sunotlan","vv44.A"
"Túlio Marcelo Clanirn da Graça","túlio.graça@outlook.com","túlio.graça","l.45.Ú"
"Tatiana Muuha de Angola","tatiana.angola@hotmail.com","tatiana.angola","aa33.I"
"Manuela Cloiz","manuela.cloiz@hotmail.com","manuela.cloiz","en46.N"
"Ariana do Amaral","ariana.amaral@msn.com","ariana.amaral","na33.N"
"Marielle Mirian de Uchôa","marielle.uchôa@bol.com.br","marielle.uchôa","ie32.E"
"Kevin Benedito Gugope","kevin.gugope@hotmail.com","kevin.gugope","vi64.."
"Chico Nendrol Upruov Ylvi Júnior","chico.júnior@hotmail.com","chico.júnior","io43.I"
"Laerte de São Pedro Júnior","laerte.júnior@hotmail.com","laerte.júnior","rr45.R"
"Juliano Shoeu","juliano.shoeu@msn.com","juliano.shoeu","li35.I"
"Davi Frederico Valente","davi.valente@bol.com.br","davi.valente","va36.V"
"Marcelo Chilagoã Ygrimson","marcelo.ygrimson@outlook.com","marcelo.ygrimson","re45.C"
"Ângelo Baltazar de Carvalho Eaeser da Cruz","ângelo.cruz@bol.com.br","ângelo.cruz","lg43.L"
"Priscila Berenice Ernvodregra de Bueno","priscila.bueno@outlook.com","priscila.bueno","sc64.I"
"Filipe de Leão","filipe.leão@outlook.com","filipe.leão","li46.L"
"Luciano Gabriel dos Santos Júnior","luciano.júnior@hotmail.com","luciano.júnior","ci55.C"
"Christie Sheila de Muniz do Espírito Santo","christie.santo@hotmail.com","christie.santo","ii55.I"
"Abílio Emni","abílio.emni@msn.com","abílio.emni","li24.I"
"Joaquim Yuri Usuema de Assis","joaquim.assis@outlook.com","joaquim.assis","aq43.A"
"Breno de Fonseca Neto","breno.neto@outlook.com","breno.neto","nn56.N"
"Heron Edivaldo Criyman","heron.criyman@outlook.com","heron.criyman","oo54.O"
"Jean Brasil Gomes","jean.gomes@bol.com.br","jean.gomes",".a54.N"
"Heitor Emílio de Álvares","heitor.álvares@hotmail.com","heitor.álvares","it42.I"
"João Bernardo d'Ávila Cozaião","joão.cozaião@hotmail.com","joão.cozaião",".o33.O"
"Ademar de Matos Kehakiga Neto","ademar.neto@msn.com","ademar.neto","da23.E"
"Zara Solange de Britto","zara.britto@outlook.com","zara.britto","rr44.A"
"Zulmira Rafaela Portugal Homaha","zulmira.homaha@hotmail.com","zulmira.homaha","ul43.L"
"Roger Max Rodrigues","roger.rodrigues@hotmail.com","roger.rodrigues","re34.E"
"Hamilton da Rocha do Nascimento Zujira","hamilton.zujira@hotmail.com","hamilton.zujira","mm45.I"
"Laerte Bento Schmidt de Azevedo","laerte.azevedo@hotmail.com","laerte.azevedo","rr54.R"
"Olímpia Danielle Urndornão","olímpia.urndornão@bol.com.br","olímpia.urndornão","ím44.M"
"Luiza da Serra","luiza.serra@bol.com.br","luiza.serra","zi34.A"
"Abílio César Xauvavic","abílio.xauvavic@bol.com.br","abílio.xauvavic","íl43.L"
"Lina de Vargas","lina.vargas@outlook.com","lina.vargas","an55.."
"Amélia Daniela de Lima Lizfy Portugal","amélia.portugal@outlook.com","amélia.portugal","ié44.I"
"João Nilton de Osório","joão.osório@hotmail.com","joão.osório","oo35.J"
"Leila de Sampaio","leila.sampaio@hotmail.com","leila.sampaio","ll34.E"
"Simão Elias do Paraná Ximenes","simão.ximenes@bol.com.br","simão.ximenes","oi23.Ã"
"Jair Imzu de Gonçalves","jair.gonçalves@hotmail.com","jair.gonçalves","ii43.R"
"Ismael Kapo","ismael.kapo@msn.com","ismael.kapo","al46.A"
"Laila Camila da Silva de Ortiz Gowaza","laila.gowaza@outlook.com","laila.gowaza","la34.A"
"Margarida de Meireles","margarida.meireles@outlook.com","margarida.meireles","ga34.G"
"Leo Ney da Silva","leo.silva@hotmail.com","leo.silva","..34.."
"Jairo Edinaldo Osuson","jairo.osuson@hotmail.com","jairo.osuson","ra33.A"
"Bruna de Trindade","bruna.trindade@hotmail.com","bruna.trindade","nn45.N"
"Wanda Marli Gomes de Novais","wanda.novais@outlook.com","wanda.novais","an45.D"
"Patrick Álvaro de Bezerra Weiss","patrick.weiss@outlook.com","patrick.weiss","at53.R"
"Jaziel Guilherme Epa","jaziel.epa@outlook.com","jaziel.epa","ii44.I"
"Bianca Ystrom","bianca.ystrom@hotmail.com","bianca.ystrom","cn34.C"
"Jussara Sandra de Leão","jussara.leão@hotmail.com","jussara.leão","rs45.A"
"Gilmara Núbia Preto Eatanma","gilmara.eatanma@hotmail.com","gilmara.eatanma","la33.A"
"Eva de Barros Besa","eva.besa@bol.com.br","eva.besa","..36.B"
"Leandro Oshifa","leandro.oshifa@hotmail.com","leandro.oshifa","nd34.D"
"Edilene Aline dos Pinhais de Souza","edilene.souza@outlook.com","edilene.souza","le42.I"
"Junior de Madureira Oyzer","junior.oyzer@msn.com","junior.oyzer","io34.N"
"Bruna Samanta de Osório","bruna.osório@outlook.com","bruna.osório","uu55.A"
"Eleriane Soraya de Arantes Mineiro Ilmo","eleriane.ilmo@hotmail.com","eleriane.ilmo","ir54.E"
"Xavier de Oliveira Caoe","xavier.caoe@hotmail.com","xavier.caoe","vi44.V"
"Alana Ana da Conceição de Bezerra","alana.bezerra@outlook.com","alana.bezerra","ln45.L"
"Beto Cauê Estrada","beto.estrada@outlook.com","beto.estrada","to32.."
"Elizabete de Ramos da Mata","elizabete.mata@hotmail.com","elizabete.mata","ai43.Z"
"Benedito Arthur Aejabiov Ivolbribo de Barros","benedito.barros@outlook.com","benedito.barros","en33.E"
"Margarida de Souza da Silva","margarida.silva@outlook.com","margarida.silva","ag32.A"
"Geraldo Jesus Mezo das Neves","geraldo.neves@msn.com","geraldo.neves","aa53.L"
"Juliana Gomes","juliana.gomes@outlook.com","juliana.gomes","il44.I"
"Ayrton Max Gomes de Assis Jernmarn","ayrton.jernmarn@bol.com.br","ayrton.jernmarn","rt13.T"
"Rafael de Álvares Rosatto","rafael.rosatto@bol.com.br","rafael.rosatto","ae45.E"
"Fabrício Bóris Paim Maciel de Osório","fabrício.osório@outlook.com","fabrício.osório","ar64.R"
"Augusto João Seixas","augusto.seixas@gmail.com","augusto.seixas","us43.U"
"Demilson Mugigani Ogacromo","demilson.ogacromo@hotmail.com","demilson.ogacromo","ii44.M"
"Raquel Daniela Alumvic Idri","raquel.idri@outlook.com","raquel.idri","el54.A"
"Jardel da Silva","jardel.silva@outlook.com","jardel.silva","de53.R"
"Sérgio Sílvio de Paranhos Tsugate","sérgio.tsugate@bol.com.br","sérgio.tsugate","gi55.R"
"Marciano Hamilton Trevisan","marciano.trevisan@msn.com","marciano.trevisan","ra55.C"
"Jeferson de Fonseca Vaz Júnior","jeferson.júnior@msn.com","jeferson.júnior","fs46.R"
"Melanie de Nogueira Iyolson","melanie.iyolson@outlook.com","melanie.iyolson","na43.L"
"Samila de Diniz","samila.diniz@gmail.com","samila.diniz","ii44.I"
"Demilson Juliano Niho","demilson.niho@outlook.com","demilson.niho","mm35.I"
"Pedro de Silveira","pedro.silveira@outlook.com","pedro.silveira","rd43.D"
"Cibele Raiane dos Santos","cibele.santos@bol.com.br","cibele.santos","il43.L"
"Demilson Schneider Issiy","demilson.issiy@bol.com.br","demilson.issiy","ll44.I"
"Jéssica da Paraíba Dabi","jéssica.dabi@bol.com.br","jéssica.dabi","si63.S"
"Raul Zoshi de Iglesias","raul.iglesias@hotmail.com","raul.iglesias","lg45.L"
"Mikaella Chihefu","mikaella.chihefu@bol.com.br","mikaella.chihefu","ak46.A"
"Severino Moisés de Ortiz","severino.ortiz@outlook.com","severino.ortiz","er65.V"
"Marcielle de Fraga","marcielle.fraga@outlook.com","marcielle.fraga","ra15.C"
"Elano da Silva de Peixoto","elano.peixoto@outlook.com","elano.peixoto","no34.N"
"Karina Brenda Schneider Pinhão de Oliveira","karina.oliveira@outlook.com","karina.oliveira","ir55.I"
"Adílson Heitor Trevisan Gomes","adílson.gomes@outlook.com","adílson.gomes","ís55.S"
"Margarete Tatiana de Ferraz","margarete.ferraz@gmail.com","margarete.ferraz","gr34.A"
"Bella Laila Bahia Oisyze","bella.oisyze@bol.com.br","bella.oisyze","le24.L"
"Renato de Pereira da Mata Pinhão","renato.pinhão@outlook.com","renato.pinhão","en45.E"
"Ingrid Trevisan de Brito Tevinã","ingrid.tevinã@outlook.com","ingrid.tevinã","gg44.R"
"Taís Eliomar de Lisboa da Silva","taís.silva@outlook.com","taís.silva","aí34.S"
"Carolina Camila de Leite Peoazman","carolina.peoazman@outlook.com","carolina.peoazman","ro33.L"
"Andréia da Silva","andréia.silva@outlook.com","andréia.silva","da44.R"
"Dionísio Emos de Salgado","dionísio.salgado@msn.com","dionísio.salgado","sí43.O"
"Matheus Coihe","matheus.coihe@outlook.com","matheus.coihe","te43.E"
"Nair Dina Boaman Schneider","nair.schneider@outlook.com","nair.schneider",".i44.R"
"Melanie de Ferreira Prates Amezão","melanie.amezão@bol.com.br","melanie.amezão","ai44.A"
"Bella de Sobral Dowabiba","bella.dowabiba@bol.com.br","bella.dowabiba","la44.E"
"Marli Bianca dos Santos Leyi da Conceição","marli.conceição@bol.com.br","marli.conceição","lr34.L"
"Denise Rosilda de Alvarenga","denise.alvarenga@hotmail.com","denise.alvarenga","is55.I"
"Tomáz de Barboza Dualorn do Nascimento","tomáz.nascimento@msn.com","tomáz.nascimento","má54.O"
"Everton Willian Gaki Opizel","everton.opizel@outlook.com","everton.opizel","rr44.T"
"Léia Paula Caope Eail de Borges","léia.borges@msn.com","léia.borges",".a43.I"
"Giovanni Cavalcante da Nóbrega","giovanni.nóbrega@hotmail.com","giovanni.nóbrega","na43.O"
"Giuseppe de Castro Castelo","giuseppe.castelo@outlook.com","giuseppe.castelo","ps35.U"
"Sâmia Iorni","sâmia.iorni@bol.com.br","sâmia.iorni","aa45.A"
"Clara Luckam","clara.luckam@hotmail.com","clara.luckam","aa33.A"
"Quitéria da Silva","quitéria.silva@hotmail.com","quitéria.silva","tt53.R"
"Marcela Maria Zane","marcela.zane@hotmail.com","marcela.zane","le44.C"
"Alexandre Daboya","alexandre.daboya@hotmail.com","alexandre.daboya","ex35.A"
"Lúcio de Braga","lúcio.braga@outlook.com","lúcio.braga","o.35.C"
"Amanda Kegapo de Fernandes","amanda.fernandes@outlook.com","amanda.fernandes","nd34.A"
"Ana Gisele Azom","ana.azom@gmail.com","ana.azom","..32.."
"Diogo Ederson do Amaral","diogo.amaral@outlook.com","diogo.amaral","gg45.O"
"Eustáquio Jonas de Barbosa dos Santos Ornlo","eustáquio.ornlo@bol.com.br","eustáquio.ornlo","uá24.S"
"Karin Serno Irntao","karin.irntao@msn.com","karin.irntao","rn54.A"
"Olívia Surunezra","olívia.surunezra@bol.com.br","olívia.surunezra","vi53.I"
"Beto Celso de Sobral","beto.sobral@bol.com.br","beto.sobral","ts35.O"
"Catarina Banhos","catarina.banhos@gmail.com","catarina.banhos","tr45.A"
